{
  "bootstrap_supply": {},
  "episode_id": "laya-reconcile-s79411",
  "force": "player",
  "projects": [
    {
      "eta_seconds": {},
      "expected_rates": {
        "chemical-plant": null,
        "fast-inserter": null,
        "offshore-pump": null,
        "oil-refinery": null,
        "passive-provider-chest": null,
        "pipe": null,
        "pipe-to-ground": null,
        "pumpjack": null,
        "transport-belt": null
      },
      "hold_until_producing": false,
      "priority": 100,
      "project_id": "chemical_refinery_and_plastic_machines",
      "required": {
        "chemical-plant": 2,
        "fast-inserter": 5,
        "offshore-pump": 1,
        "oil-refinery": 4,
        "passive-provider-chest": 1,
        "pipe": 50,
        "pipe-to-ground": 20,
        "pumpjack": 3,
        "transport-belt": 14
      },
      "reserved": {},
      "revision": 5,
      "sequence": 1,
      "source_producers": {
        "chemical-plant": "stock",
        "fast-inserter": "stock",
        "offshore-pump": "stock",
        "oil-refinery": "stock",
        "passive-provider-chest": "stock",
        "pipe": "stock",
        "pipe-to-ground": "stock",
        "pumpjack": "stock",
        "transport-belt": "stock"
      },
      "state": "constructing",
      "target_item": "plastic-bar"
    },
    {
      "eta_seconds": {},
      "expected_rates": {
        "electric-furnace": null,
        "electric-mining-drill": null,
        "inserter": null,
        "medium-electric-pole": null,
        "passive-provider-chest": null
      },
      "hold_until_producing": false,
      "priority": 100,
      "project_id": "conversion_steel-plate",
      "required": {
        "electric-furnace": 2,
        "electric-mining-drill": 1,
        "inserter": 2,
        "medium-electric-pole": 2,
        "passive-provider-chest": 1
      },
      "reserved": {},
      "revision": 3,
      "sequence": 2,
      "source_producers": {
        "electric-furnace": "stock",
        "electric-mining-drill": "stock",
        "inserter": "stock",
        "medium-electric-pole": "stock",
        "passive-provider-chest": "stock"
      },
      "state": "constructing",
      "target_item": "steel-plate"
    },
    {
      "eta_seconds": {},
      "expected_rates": {
        "electric-furnace": null,
        "electric-mining-drill": null,
        "inserter": null,
        "medium-electric-pole": null,
        "passive-provider-chest": null
      },
      "hold_until_producing": false,
      "priority": 50,
      "project_id": "direct_iron-plate_starter",
      "required": {
        "electric-furnace": 2,
        "electric-mining-drill": 2,
        "inserter": 2,
        "medium-electric-pole": 2,
        "passive-provider-chest": 1
      },
      "reserved": {},
      "revision": 2,
      "sequence": 3,
      "source_producers": {
        "electric-furnace": "stock",
        "electric-mining-drill": "stock",
        "inserter": "stock",
        "medium-electric-pole": "stock",
        "passive-provider-chest": "stock"
      },
      "state": "constructing",
      "target_item": null
    },
    {
      "eta_seconds": {},
      "expected_rates": {
        "big-electric-pole": null
      },
      "hold_until_producing": false,
      "priority": 50,
      "project_id": "power_bridge",
      "required": {
        "big-electric-pole": 1
      },
      "reserved": {},
      "revision": 52,
      "sequence": 4,
      "source_producers": {
        "big-electric-pole": "stock"
      },
      "state": "constructing",
      "target_item": null
    },
    {
      "eta_seconds": {},
      "expected_rates": {
        "electric-furnace": null,
        "electric-mining-drill": null,
        "inserter": null,
        "medium-electric-pole": null,
        "passive-provider-chest": null
      },
      "hold_until_producing": false,
      "priority": 50,
      "project_id": "direct_copper-plate_starter",
      "required": {
        "electric-furnace": 1,
        "electric-mining-drill": 1,
        "inserter": 1,
        "medium-electric-pole": 1,
        "passive-provider-chest": 1
      },
      "reserved": {},
      "revision": 2,
      "sequence": 5,
      "source_producers": {
        "electric-furnace": "stock",
        "electric-mining-drill": "stock",
        "inserter": "stock",
        "medium-electric-pole": "stock",
        "passive-provider-chest": "stock"
      },
      "state": "constructing",
      "target_item": null
    },
    {
      "eta_seconds": {},
      "expected_rates": {
        "roboport": null
      },
      "hold_until_producing": false,
      "priority": 50,
      "project_id": "roboport_bridge",
      "required": {
        "roboport": 1
      },
      "reserved": {},
      "revision": 28,
      "sequence": 6,
      "source_producers": {
        "roboport": "stock"
      },
      "state": "constructing",
      "target_item": null
    },
    {
      "eta_seconds": {},
      "expected_rates": {
        "assembling-machine-1": null,
        "inserter": null,
        "passive-provider-chest": null,
        "requester-chest": null,
        "substation": null
      },
      "hold_until_producing": true,
      "priority": 100,
      "project_id": "paired_mall_copper-cable",
      "required": {
        "assembling-machine-1": 1,
        "inserter": 2,
        "passive-provider-chest": 1,
        "requester-chest": 1,
        "substation": 1
      },
      "reserved": {},
      "revision": 8,
      "sequence": 7,
      "source_producers": {
        "assembling-machine-1": "stock",
        "inserter": "stock",
        "passive-provider-chest": "stock",
        "requester-chest": "stock",
        "substation": "stock"
      },
      "state": "completed",
      "target_item": "copper-cable"
    },
    {
      "eta_seconds": {},
      "expected_rates": {
        "electric-mining-drill": null,
        "substation": null,
        "transport-belt": null
      },
      "hold_until_producing": false,
      "priority": 50,
      "project_id": "mining_copper-ore",
      "required": {
        "electric-mining-drill": 6,
        "substation": 1,
        "transport-belt": 13
      },
      "reserved": {},
      "revision": 2,
      "sequence": 8,
      "source_producers": {
        "electric-mining-drill": null,
        "substation": "stock",
        "transport-belt": null
      },
      "state": "constructing",
      "target_item": null
    },
    {
      "eta_seconds": {},
      "expected_rates": {
        "assembling-machine-1": null,
        "inserter": null,
        "passive-provider-chest": null
      },
      "hold_until_producing": true,
      "priority": 100,
      "project_id": "paired_mall_electronic-circuit",
      "required": {
        "assembling-machine-1": 1,
        "inserter": 2,
        "passive-provider-chest": 1
      },
      "reserved": {},
      "revision": 4,
      "sequence": 9,
      "source_producers": {
        "assembling-machine-1": "stock",
        "inserter": "stock",
        "passive-provider-chest": "stock"
      },
      "state": "completed",
      "target_item": "electronic-circuit"
    },
    {
      "eta_seconds": {},
      "expected_rates": {
        "electric-furnace": null,
        "electric-mining-drill": null,
        "inserter": null,
        "medium-electric-pole": null,
        "passive-provider-chest": null
      },
      "hold_until_producing": false,
      "priority": 50,
      "project_id": "direct_stone-brick_starter",
      "required": {
        "electric-furnace": 1,
        "electric-mining-drill": 2,
        "inserter": 1,
        "medium-electric-pole": 2,
        "passive-provider-chest": 1
      },
      "reserved": {},
      "revision": 2,
      "sequence": 10,
      "source_producers": {
        "electric-furnace": "stock",
        "electric-mining-drill": "stock",
        "inserter": "stock",
        "medium-electric-pole": "stock",
        "passive-provider-chest": "stock"
      },
      "state": "constructing",
      "target_item": null
    },
    {
      "eta_seconds": {},
      "expected_rates": {
        "assembling-machine-1": null,
        "inserter": null,
        "passive-provider-chest": null,
        "requester-chest": null
      },
      "hold_until_producing": true,
      "priority": 100,
      "project_id": "paired_mall_iron-gear-wheel",
      "required": {
        "assembling-machine-1": 1,
        "inserter": 2,
        "passive-provider-chest": 1,
        "requester-chest": 1
      },
      "reserved": {},
      "revision": 4,
      "sequence": 11,
      "source_producers": {
        "assembling-machine-1": "stock",
        "inserter": "stock",
        "passive-provider-chest": "stock",
        "requester-chest": "stock"
      },
      "state": "completed",
      "target_item": "iron-gear-wheel"
    },
    {
      "eta_seconds": {},
      "expected_rates": {
        "assembling-machine-1": null,
        "inserter": null,
        "passive-provider-chest": null
      },
      "hold_until_producing": true,
      "priority": 100,
      "project_id": "paired_mall_electric-mining-drill",
      "required": {
        "assembling-machine-1": 1,
        "inserter": 2,
        "passive-provider-chest": 1
      },
      "reserved": {},
      "revision": 4,
      "sequence": 12,
      "source_producers": {
        "assembling-machine-1": "stock",
        "inserter": "stock",
        "passive-provider-chest": "stock"
      },
      "state": "completed",
      "target_item": "electric-mining-drill"
    },
    {
      "eta_seconds": {},
      "expected_rates": {
        "electric-mining-drill": null,
        "substation": null,
        "transport-belt": null
      },
      "hold_until_producing": false,
      "priority": 50,
      "project_id": "mining_stone",
      "required": {
        "electric-mining-drill": 6,
        "substation": 1,
        "transport-belt": 13
      },
      "reserved": {},
      "revision": 2,
      "sequence": 13,
      "source_producers": {